{
  "iso2": "AW",
  "iso3": "ABW",
  "iso_numeric": "533",
  "name": "Aruba",
  "demonym": "Aruban",
  "continent": "NA",
  "region": "Caribbean",
  "capital": "Oranjestad",
  "currency": "AWG",
  "languages": [
    "nl",
    "pap"
  ],
  "dialing_code": "297",
  "tld": [
    ".aw"
  ],
  "latlng": [
    12.5,
    -69.96666666
  ],
  "timezones": [
    "America/Aruba"
  ]
}
