{
  "iso2": "YT",
  "iso3": "MYT",
  "iso_numeric": "175",
  "name": "Mayotte",
  "demonym": "Mahoran",
  "continent": "AF",
  "region": "Eastern Africa",
  "capital": "Mamoudzou",
  "currency": "EUR",
  "languages": [
    "fr"
  ],
  "dialing_code": "262",
  "tld": [
    ".yt"
  ],
  "latlng": [
    -12.83333333,
    45.16666666
  ],
  "timezones": [
    "Indian/Mayotte"
  ]
}
