{
  "iso2": "AZ",
  "iso3": "AZE",
  "iso_numeric": "031",
  "name": "Azerbaijan",
  "native_name": "Azərbaycan",
  "demonym": "Azerbaijani",
  "continent": "AS",
  "region": "Western Asia",
  "capital": "Baku",
  "currency": "AZN",
  "languages": [
    "az"
  ],
  "dialing_code": "994",
  "tld": [
    ".az"
  ],
  "latlng": [
    40.5,
    47.5
  ],
  "timezones": [
    "Asia/Baku"
  ],
  "borders": [
    "AM",
    "GE",
    "IR",
    "RU",
    "TR"
  ]
}
